{
  "schemaVersion": 1,
  "baseUrl": "https://demo.wizardgang.ai",
  "accountableOwners": {
    "registry": "Management-System Owner",
    "lifecycle": "Management-System Owner",
    "evidence": "Evidence Custodian",
    "claims": "Management-System Owner",
    "objectives": "WizardGang",
    "compliance": "Management-System Owner / Evidence Custodian",
    "risks": "Risk Owner",
    "incidents": "Incident Response Owner",
    "exercises": "Incident Response Owner",
    "advisories": "Security Owner",
    "documents": "Management-System Owner / Evidence Custodian",
    "governance-records": "Management-System Owner / Evidence Custodian",
    "securityReporting": "Security Owner"
  },
  "securityReporting": {
    "policyRoute": "/security",
    "securityTxtRoute": "/.well-known/security.txt",
    "privateReportingUrl": "https://github.com/Wizard-Gang/wizardgang-architecture-demo/security/advisories/new",
    "privateReportingApi": "https://api.github.com/repos/Wizard-Gang/wizardgang-architecture-demo/private-vulnerability-reporting",
    "expirySource": "src/api/security-policy.ts"
  }
}
